,Unnamed: 0,Abstract,Authors,Journal,Link,Title,Year,LastAuthor,FirstAuthor,Lab,Author,Count,Team
147,290,"
    

    
      Transplantation of hematopoietic stem cells (HSCs) from human umbilical cord blood (hUCB) holds great promise for treating a broad spectrum of hematological disorders including cancer. However, the limited number of HSCs in a single hUCB unit restricts its widespread use. Although extensive efforts have led to multiple methods for ex vivo expansion of human HSCs by targeting single molecules or pathways, it remains unknown whether it is possible to simultaneously manipulate the large number of targets essential for stem cell self-renewal. Recent studies indicate that N","Li Z, Qian P, Shao W, Shi H, He XC, Gogol MM, Yu Z, Wang Y, Qi M, Zhu Y, Perry JM, Zhang K, Tao F, Zhou K, Hu D, Han Y, Zhao C, Alexander R, Xu H, Chen S, Peak A, Hall K, Peterson M, Perera AG, Haug JS, Parmely T, Li H, Shen B, Zeitlinger J, He C, Li L, ",Cell research,https://www.ncbi.nlm.nih.gov/pubmed/30065315,Suppression of M 6 A Reader Ythdf2 Promotes Hematopoietic Stem Cell Expansion,2018,Li L,Li Z,Li,Li H,20,CompBio
148,307,"
    

    
      Proliferating cells known as neoblasts include pluripotent stem cells (PSCs) that sustain tissue homeostasis and regeneration of lost body parts in planarians. However, the lack of markers to prospectively identify and isolate these adult PSCs has significantly hampered their characterization. We used single-cell RNA sequencing (scRNA-seq) and single-cell transplantation to address this long-standing issue. Large-scale scRNA-seq of sorted neoblasts unveiled a novel subtype of neoblast (Nb2) characterized by high levels of PIWI-1 mRNA and protein and marked by a conserved cell-surface protein-coding gene, tetraspanin 1 (tspan-1). tspan-1-positive cells survived sub-lethal irradiation, underwent clonal expansion to repopulate whole animals, and when purified with an anti-TSPAN-1 antibody, rescued the viability of lethally irradiated animals after single-cell transplantation. The first prospective isolation of an adult PSC bridges a conceptual dichotomy between functionally and molecularly defined neoblasts, shedding light on mechanisms governing in vivo pluripotency and a source of regeneration in animals. VIDEO ABSTRACT.
    

    
  ","Zeng A, Li H, Guo L, Gao X, McKinney SA,, Wang Y, Yu Z, Park J, Semerad C, Ross E, Cheng LC, Davies E, Lei K, Wang W, Perera AG, Hall K, Peak A, Box AC, Sánchez Alvarado A, ",Cell,https://www.ncbi.nlm.nih.gov/pubmed/29906446,Prospectively Isolated Tetraspanin + Neoblasts Are Adult Pluripotent Stem Cells Underlying Planaria Regeneration,2018,Sánchez Alvarado A,Zeng A,Sánchez,Li H,20,CompBio
149,313,"
    

    
      Hox genes modulate the properties of hematopoietic stem cells (HSCs) and reacquired Hox expression in progenitors contributes to leukemogenesis. Here, our transcriptome and DNA methylome analyses revealed that Hoxb cluster and retinoid signaling genes are predominantly enriched in LT-HSCs, and this coordinate regulation of Hoxb expression is mediated by a retinoid-dependent cis-regulatory element, distal element RARE (DERARE). Deletion of the DERARE reduced Hoxb expression, resulting in changes to many downstream signaling pathways (e.g., non-canonical Wnt signaling) and loss of HSC self-renewal and reconstitution capacity. DNA methyltransferases mediate DNA methylation on the DERARE, leading to reduced Hoxb cluster expression. Acute myeloid leukemia patients with DNMT3A mutations exhibit DERARE hypomethylation, elevated HOXB expression, and adverse outcomes. CRISPR-Cas9-mediated specific DNA methylation at DERARE attenuated HOXB expression and alleviated leukemogenesis. Collectively, these findings demonstrate pivotal roles for retinoid signaling and the DERARE in maintaining HSCs and preventing leukemogenesis by coordinate regulation of Hoxb genes.
    

    
  ","Qian P, De Kumar B, He XC, Nolte C, Gogol MM, Ahn Y, Chen S, Li Z, Xu H, Perry JM, Hu D, Tao F, Zhao M, Han Y, Hall K, Peak A, Paulson A, Zhao C, Venkatraman A, Box AC, Perera AG, Haug JS, Parmely T, Li H, Krumlauf R, Li L, ",Cell stem cell,https://www.ncbi.nlm.nih.gov/pubmed/29727682,Retinoid-Sensitive Epigenetic Regulation of the Hoxb Cluster Maintains Normal Hematopoiesis and Inhibits Leukemogenesis,2018,Li L,Qian P,Li,Li H,20,CompBio
150,375,"
    

    
      Piwi-interacting RNAs (piRNAs) are important for repressing transposable elements (TEs) and modulating gene expression in germ cells, thereby maintaining genome stability and germ cell function. Although they are also important for maintaining germline stem cells (GSCs) in the ","Story B, Ma X, Ishihara K, Li H, Hall K, Peak A, Perera AG, Park J, Haug J, Blanchette M, Xie T, ",Life science alliance,https://www.ncbi.nlm.nih.gov/pubmed/31624801,Defining the Expression of piRNA and Transposable Elements in Drosophila Ovarian Germline Stem Cells and Somatic Support Cells,2019,Xie T,Story B,Xie,Li H,20,CompBio
151,383,"
    

    
      Planar cell polarity (PCP) plays crucial roles in developmental processes such as gastrulation, neural tube closure and hearing. Wnt pathway mutants are often classified as PCP mutants due to similarities between their phenotypes. Here, we show that in the zebrafish lateral line, disruptions of the PCP and Wnt pathways have differential effects on hair cell orientations. While mutations in the PCP genes vangl2 and scrib cause random orientations of hair cells, mutations in wnt11f1, gpc4 and fzd7a/b induce hair cells to adopt a concentric pattern. This concentric pattern is not caused by defects in PCP but is due to misaligned support cells. The molecular basis of the support cell defect is unknown but we demonstrate that the PCP and Wnt pathways work in parallel to establish proper hair cell orientation. Consequently, hair cell orientation defects are not solely explained by defects in PCP signaling, and some hair cell phenotypes warrant re-evaluation.
    

    
  ","Navajas Acedo J, Voas MG, Alexander R, Woolley T, Unruh JR, Li H, Moens C, Piotrowski T, ",Nature communications,https://www.ncbi.nlm.nih.gov/pubmed/31488837,PCP and Wnt Pathway Components Act in Parallel During Zebrafish Mechanosensory Hair Cell Orientation,2019,Piotrowski T,Navajas Acedo J,Piotrowski,Li H,20,CompBio
152,403,"
    

    
      The spatial organization of the genome is enigmatic. Direct evidence of physical contacts between chromosomes and their visualization at nanoscale resolution has been limited. We used superresolution microscopy to demonstrate that ribosomal DNA (rDNA) can form linkages between chromosomes. We observed rDNA linkages in many different human cell types and demonstrated their resolution in anaphase. rDNA linkages are coated by the transcription factor UBF and their formation depends on UBF, indicating that they regularly occur between transcriptionally active loci. Overexpression of c-Myc increases rDNA transcription and the frequency of rDNA linkages, further suggesting that their formation depends on active transcription. Linkages persist in the absence of cohesion, but inhibition of topoisomerase II prevents their resolution in anaphase. We propose that linkages are topological intertwines occurring between transcriptionally active rDNA loci spatially colocated in the same nucleolar compartment. Our findings suggest that active DNA loci engage in physical interchromosomal connections that are an integral and pervasive feature of genome organization.
    

    
  ","Potapova TA, Unruh JR, Yu Z, Rancati G, Li H, Stampfer MR, Gerton JL, ",The Journal of cell biology,https://www.ncbi.nlm.nih.gov/pubmed/31270138,Superresolution Microscopy Reveals Linkages Between Ribosomal DNA on Heterologous Chromosomes,2019,Gerton JL,Potapova TA,Gerton,Li H,20,CompBio
153,408,"
    

    
      FACT (facilitates chromatin transcription) is an evolutionarily conserved histone chaperone that was initially identified as an activity capable of promoting RNA polymerase II (Pol II) transcription through nucleosomes in vitro. In this report, we describe a global analysis of FACT function in Pol II transcription in Drosophila. We present evidence that loss of FACT has a dramatic impact on Pol II elongation-coupled processes including histone H3 lysine 4 (H3K4) and H3K36 methylation, consistent with a role for FACT in coordinating histone modification and chromatin architecture during Pol II transcription. Importantly, we identify a role for FACT in the maintenance of promoter-proximal Pol II pausing, a key step in transcription activation in higher eukaryotes. These findings bring to light a broader role for FACT in the regulation of Pol II transcription.
    

    
  ","Tettey TT, Gao X, Shao W, Li H, Story BA, Chitsazan AD, Glaser RL, Goode ZH, Seidel CW, Conaway RC, Zeitlinger J, Blanchette M, Conaway JW, ",Cell reports,https://www.ncbi.nlm.nih.gov/pubmed/31242411,A Role for FACT in RNA Polymerase II Promoter-Proximal Pausing,2019,Conaway JW,Tettey TT,Conaway,Li H,20,CompBio
154,485,"
    

    
      5-Methylcytosine (m","Zou F, Tu R, Duan B, Yang Z, Ping Z, Song X, Chen S, Price A, Li H, Scott A, Perera AG, Li S, Xie T, ",Proceedings of the National Academy of Sciences of the United States of America,https://www.ncbi.nlm.nih.gov/pubmed/32015133,Drosophila YBX1 Homolog YPS Promotes Ovarian Germ Line Stem Cell Development by Preferentially Recognizing 5-methylcytosine RNAs,2020,Xie T,Zou F,Xie,Li H,20,CompBio
155,20,"
    

    
      Neoblasts are an abundant, heterogeneous population of adult stem cells (ASCs) that facilitate the maintenance of planarian tissues and organs, providing a powerful system to study ASC self-renewal and differentiation dynamics. It is unknown how the collective output of neoblasts transit through differentiation pathways to produce specific cell types. The planarian epidermis is a simple tissue that undergoes rapid turnover. We found that as epidermal progeny differentiate, they progress through multiple spatiotemporal transition states with distinct gene expression profiles. We also identified a conserved early growth response family transcription factor, egr-5, that is essential for epidermal differentiation. Disruption of epidermal integrity by egr-5 RNAi triggers a global stress response that induces the proliferation of neoblasts and the concomitant expansion of not only epidermal, but also multiple progenitor cell populations. Our results further establish the planarian epidermis as a novel paradigm to uncover the molecular mechanisms regulating ASC specification in vivo. 
    

    
  ","Tu KC, Cheng LC, T K Vu H, Lange JJ, McKinney SA,A, Seidel CW, Sánchez Alvarado A, ",eLife,http://www.ncbi.nlm.nih.gov/pubmed/26457503,Egr-5 Is a Post-Mitotic Regulator of Planarian Epidermal Differentiation,2015,Sánchez Alvarado A,Tu KC,Sánchez,Lange JJ,12,Microscopy
156,195,"
    

    
      The kinetochore is a large, evolutionarily conserved protein structure that connects chromosomes with microtubules. During chromosome segregation, outer kinetochore components track depolymerizing ends of microtubules to facilitate the separation of chromosomes into two cells. In budding yeast, each chromosome has a point centromere upon which a single kinetochore is built, which attaches to a single microtubule. This defined architecture facilitates quantitative examination of kinetochores during the cell cycle. Using three independent measures-calibrated imaging, FRAP, and photoconversion-we find that the Dam1 submodule is unchanged during anaphase, whereas MIND and Ndc80 submodules add copies to form an ""anaphase configuration"" kinetochore. Microtubule depolymerization and kinesin-related motors contribute to copy addition. Mathematical simulations indicate that the addition of microtubule attachments could facilitate tracking during rapid microtubule depolymerization. We speculate that the minimal kinetochore configuration, which exists from G1 through metaphase, allows for correction of misattachments. Our study provides insight into dynamics and plasticity of the kinetochore structure during chromosome segregation in living cells.
    

    
  ","Dhatchinamoorthy K, Shivaraju M, Lange JJ, Rubinstein BY, Unruh JR, Slaughter BD, Gerton JL, ",The Journal of cell biology,https://www.ncbi.nlm.nih.gov/pubmed/28939613,Structural Plasticity of the Living Kinetochore,2017,Gerton JL,Dhatchinamoorthy K,Gerton,Lange JJ,12,Microscopy
157,222,"
    

    
      Meiotic drivers are selfish genes that bias their transmission into gametes, defying Mendelian inheritance. Despite the significant impact of these genomic parasites on evolution and infertility, few meiotic drive loci have been identified or mechanistically characterized. Here, we demonstrate a complex landscape of meiotic drive genes on chromosome 3 of the fission yeasts ","Nuckolls NL, Bravo Núñez MA, Eickbush MT, Young JM, Lange JJ, Yu JS, Smith GR, Jaspersen SL, Malik HS, Zanders SE, ",eLife,https://www.ncbi.nlm.nih.gov/pubmed/28631612,wtf Genes Are Prolific Dual Poison-Antidote Meiotic Drivers,2017,Zanders SE,Nuckolls NL,Zanders,Lange JJ,12,Microscopy
158,223,"
","De Kumar B, Parker HJ, Parrish ME, Lange JJ, Slaughter BD, Unruh JR, Paulson A, Krumlauf R, ",Proceedings of the National Academy of Sciences of the United States of America,https://www.ncbi.nlm.nih.gov/pubmed/28584089,Dynamic Regulation of Nanog and Stem Cell-Signaling Pathways by Hoxa1 During Early Neuro-Ectodermal Differentiation of ES Cells,2017,Krumlauf R,De Kumar B,Krumlauf,Lange JJ,12,Microscopy
159,275,"
    

    
      Meiotic drivers are selfish alleles that subvert gametogenesis to increase their transmission into progeny. Drivers impose a fitness cost, putting pressure on the genome to evolve suppressors. Here we investigate the wtf gene family from Schizosaccharomyces pombe, previously shown to contain meiotic drivers in wild isolates. We discovered that wtf13 found in lab stocks is a meiotic driver. wtf13 kills spores that do not inherit it by generating both a diffusible poison and a spore-specific antidote. Additionally, we demonstrate that wtf13 is suppressed by another wtf gene, wtf18-2, that arose spontaneously in the lab and makes only an antidote. Wtf18-2 does not act indiscriminately to prevent spore destruction. Instead, it rescues only the spores that inherit wtf18-2. In this way, wtf18-2 selfishly gains a transmission advantage of its own while dampening the drive of wtf13. This establishes a novel paradigm for meiotic drive suppressors and provides insight into the mechanisms and evolution of drive systems.
    

    
  ","Bravo Núñez MA, Lange JJ, Zanders SE, ",PLoS genetics,https://www.ncbi.nlm.nih.gov/pubmed/30475921,A Suppressor of a WTF Poison-Antidote Meiotic Driver Acts via Mimicry of the Driver's Antidote,2018,Zanders SE,Bravo Núñez MA,Zanders,Lange JJ,12,Microscopy
160,301,"
    

    
      Protein self-assemblies modulate protein activities over biological timescales that can exceed the lifetimes of the proteins or even the cells that harbor them. We hypothesized that these timescales relate to kinetic barriers inherent to the nucleation of ordered phases. To investigate nucleation barriers in living cells, we developed distributed amphifluoric FRET (DAmFRET). DAmFRET exploits a photoconvertible fluorophore, heterogeneous expression, and large cell numbers to quantify via flow cytometry the extent of a protein's self-assembly as a function of cellular concentration. We show that kinetic barriers limit the nucleation of ordered self-assemblies and that the persistence of the barriers with respect to concentration relates to structure. Supersaturation resulting from sequence-encoded nucleation barriers gave rise to prion behavior and enabled a prion-forming protein, Sup35 PrD, to partition into dynamic intracellular condensates or to form toxic aggregates. Our results suggest that nucleation barriers govern cytoplasmic inheritance, subcellular organization, and proteotoxicity.
    

    
  ","Khan T, Kandola TS, Wu J, Venkatesan S, Ketter E, Lange JJ, Rodríguez Gama A, Box AC, Unruh JR, Cook M, Halfmann R, ",Molecular cell,https://www.ncbi.nlm.nih.gov/pubmed/29979963,Quantifying Nucleation In Vivo Reveals the Physical Basis of Prion-like Phase Behavior,2018,Halfmann R,Khan T,Halfmann,Lange JJ,12,Microscopy
161,394,"
    

    
      Differential coordination of growth and patterning across metazoans gives rise to a diversity of sizes and shapes at tissue, organ and organismal levels. Although tissue size and tissue function can be interdependent","Arnold CP, Benham-Pyle BW, Lange JJ, Wood CJ, Sánchez Alvarado A, ",Nature,https://www.ncbi.nlm.nih.gov/pubmed/31413361,Wnt and TGFβ Coordinate Growth and Patterning to Regulate Size-Dependent Behaviour,2019,Sánchez Alvarado A,Arnold CP,Sánchez,Lange JJ,12,Microscopy
162,402,"
    

    
      Prion-like proteins can assume distinct conformational and physical states in the same cell. Sequence analysis suggests that prion-like proteins are prevalent in various species; however, it remains unclear what functional space they occupy in multicellular organisms. Here, we report the identification of a prion-like protein, Herzog (CG5830), through a multimodal screen in Drosophila melanogaster. Herzog functions as a membrane-associated phosphatase and controls embryonic patterning, likely being involved in TGF-β/BMP and FGF/EGF signaling pathways. Remarkably, monomeric Herzog is enzymatically inactive and becomes active upon amyloid-like assembly. The prion-like domain of Herzog is necessary for both its assembly and membrane targeting. Removal of the prion-like domain impairs activity, while restoring assembly on the membrane using a heterologous prion-like domain and membrane-targeting motif can restore phosphatase activity. This study provides an example of a prion-like domain that allows an enzyme to gain essential functionality via amyloid-like assembly to control animal development.
    

    
  ","Nil Z, Hervás R, Gerbich T, Leal P, Yu Z, Saraf A, Sardiu M, Lange JJ, Yi K, Unruh JR, Slaughter B, Si K, ",Cell,https://www.ncbi.nlm.nih.gov/pubmed/31491385,Amyloid-like Assembly Activates a Phosphatase in the Developing Drosophila Embryo,2019,Si K,Nil Z,Si,Lange JJ,12,Microscopy
163,406,"
    

    
      The kinetochore is a large molecular machine that attaches chromosomes to microtubules and facilitates chromosome segregation. The kinetochore includes submodules that associate with the centromeric DNA and submodules that attach to microtubules. Additional copies of several submodules of the kinetochore are added during anaphase, including the microtubule binding module Ndc80. While the factors governing plasticity are not known, they could include regulation based on microtubule-kinetochore interactions. We report that Fin1 localizes to the microtubule-proximal edge of the kinetochore cluster during anaphase based on single-particle averaging of super-resolution images. Fin1 is required for the assembly of normal levels of Dam1 and Ndc80 submodules. Levels of Ndc80 further depend on the Dam1 microtubule binding complex. Our results suggest the stoichiometry of outer kinetochore submodules is strongly influenced by factors at the kinetochore-microtubule interface such as Fin1 and Dam1, and phosphorylation by cyclin-dependent kinase. Outer kinetochore stoichiometry is remarkably plastic and responsive to microtubule-proximal regulation.
    

    
  ","Dhatchinamoorthy K, Unruh JR, Lange JJ, Levy M, Slaughter BD, Gerton JL, ",The Journal of cell biology,https://www.ncbi.nlm.nih.gov/pubmed/31118239,The Stoichiometry of the Outer Kinetochore Is Modulated by Microtubule-Proximal Regulatory Factors,2019,Gerton JL,Dhatchinamoorthy K,Gerton,Lange JJ,12,Microscopy
164,486,"
    

    
      Meiotic drivers are selfish alleles that can force their transmission into more than 50% of the viable gametes made by heterozygotes. Meiotic drivers are known to cause infertility in a diverse range of eukaryotes and are predicted to affect the evolution of genome structure and meiosis. The wtf gene family of Schizosaccharomyces pombe includes both meiotic drivers and drive suppressors and thus offers a tractable model organism to study drive systems. Currently, only a handful of wtf genes have been functionally characterized and those genes only partially reflect the diversity of the wtf gene family. In this work, we functionally test 22 additional wtf genes for meiotic drive phenotypes. We identify eight new drivers that share between 30-90% amino acid identity with previously characterized drivers. Despite the vast divergence between these genes, they generally drive into >85% of gametes when heterozygous. We also identify three wtf genes that suppress other wtf drivers, including two that also act as autonomous drivers. Additionally, we find that wtf genes do not underlie a weak (64% allele transmission) meiotic driver on chromosome 1. Finally, we find that some Wtf proteins have expression or localization patterns that are distinct from the poison and antidote proteins encoded by drivers and suppressors, suggesting some wtf genes may have non-meiotic drive functions. Overall, this work expands our understanding of the wtf gene family and the burden selfish driver genes impose on S. pombe.
    

    
  ","Bravo Núñez MA, Sabbarini IM, Eickbush MT, Liang Y, Lange JJ, Kent AM, Zanders SE, ",PLoS genetics,https://www.ncbi.nlm.nih.gov/pubmed/32032353,Dramatically Diverse Schizosaccharomyces Pombe WTF Meiotic Drivers All Display High Gamete-Killing Efficiency,2020,Zanders SE,Bravo Núñez MA,Zanders,Lange JJ,12,Microscopy
165,21,"
    

    
      Adult stem cells continuously undergo self-renewal and generate differentiated cells. In the Drosophila ovary, two separate niches control germ line stem cell (GSC) self-renewal and differentiation processes. Compared to the self-renewing niche, relatively little is known about the maintenance and function of the differentiation niche. In this study, we show that the cellular redox state regulated by Wnt signaling is critical for the maintenance and function of the differentiation niche to promote GSC progeny differentiation. Defective Wnt signaling causes the loss of the differentiation niche and the upregulated BMP signaling in differentiated GSC progeny, thereby disrupting germ cell differentiation. Mechanistically, Wnt signaling controls the expression of multiple glutathione-S-transferase family genes and the cellular redox state. Finally, Wnt2 and Wnt4 function redundantly to maintain active Wnt signaling in the differentiation niche. Therefore, this study has revealed a novel strategy for Wnt signaling in regulating the cellular redox state and maintaining the differentiation niche. 
    

    
  ","Wang S, Gao Y, Song X, Ma X, Zhu X, Mao Y, Yang Z, Ni J, Li H, Malanowski KE, Perera AG, Park J, Haug J, Xie T, ",eLife,http://www.ncbi.nlm.nih.gov/pubmed/26452202,Wnt Signaling-Mediated Redox Regulation Maintains the Germ Line Stem Cell Differentiation Niche,2015,Xie T,Wang S,Xie,Perera AG,4,Sequencing
166,192,"
    

    
      Neural crest cells migrate throughout the embryo, but how cells move in a directed and collective manner has remained unclear. Here, we perform the first single-cell transcriptome analysis of cranial neural crest cell migration at three progressive stages in chick and identify and establish hierarchical relationships between cell position and time-specific transcriptional signatures. We determine a novel transcriptional signature of the most invasive neural crest Trailblazer cells that is consistent during migration and enriched for approximately 900 genes. Knockdown of several Trailblazer genes shows significant but modest changes to total distance migrated. However, in vivo expression analysis by RNAscope and immunohistochemistry reveals some salt and pepper patterns that include strong individual Trailblazer gene expression in cells within other subregions of the migratory stream. These data provide new insights into the molecular diversity and dynamics within a neural crest cell migratory stream that underlie complex directed and collective cell behaviors.
    

    
  ","Morrison JA, McLennan R, Wolfe LA, Gogol MM, Meier S, McKinney MC, Teddy JM, Holmes L, Semerad CL, Box AC, Li H, Hall KE, Perera AG, Kulesa PM, ",eLife,https://www.ncbi.nlm.nih.gov/pubmed/29199959,Single-cell Transcriptome Analysis of Avian Neural Crest Migration Reveals Signatures of Invasion and Molecular Transitions,2017,Kulesa PM,Morrison JA,Kulesa,Perera AG,4,Sequencing
