,Unnamed: 0,Abstract,Authors,Journal,Link,Title,Year,LastAuthor,FirstAuthor,Lab,Author,Count,Team
73,500,"
    

    
      Meiotic recombination begins with the induction of programmed double-strand breaks (DSBs). In most organisms only a fraction of DSBs become crossovers. Here we report a novel meiotic gene, vilya, which encodes a protein with homology to Zip3-like proteins shown to determine DSB fate in other organisms. Vilya is required for meiotic DSB formation, perhaps as a consequence of its interaction with the DSB accessory protein Mei-P22, and localizes to those DSB sites that will mature into crossovers. In early pachytene Vilya localizes along the central region of the synaptonemal complex and to discrete foci. The accumulation of Vilya at foci is dependent on DSB formation. Immuno-electron microscopy demonstrates that Vilya is a component of recombination nodules, which mark the sites of crossover formation. Thus Vilya links the mechanism of DSB formation to either the selection of those DSBs that will become crossovers or to the actual process of crossing over. 
    

    
  ","Lake CM, Nielsen RJ, Guo F, Unruh JR, Slaughter BD, Hawley RS, ",eLife,https://www.ncbi.nlm.nih.gov/pubmed/26452093,"Vilya, a Component of the Recombination Nodule, Is Required for Meiotic Double-Strand Break Formation in Drosophila",2015,Hawley RS,Lake CM,Hawley,Unruh JR,31,Microscopy
74,4,"
","Kim S, Ma L, Unruh JR, McKinney SA,, Yu CR, ",BMC neuroscience,http://www.ncbi.nlm.nih.gov/pubmed/26667019,Intracellular Chloride Concentration of the Mouse Vomeronasal Neuron,2015,Yu CR,Kim S,Yu,McKinney SA,9,Microscopy
75,20,"
    

    
      Neoblasts are an abundant, heterogeneous population of adult stem cells (ASCs) that facilitate the maintenance of planarian tissues and organs, providing a powerful system to study ASC self-renewal and differentiation dynamics. It is unknown how the collective output of neoblasts transit through differentiation pathways to produce specific cell types. The planarian epidermis is a simple tissue that undergoes rapid turnover. We found that as epidermal progeny differentiate, they progress through multiple spatiotemporal transition states with distinct gene expression profiles. We also identified a conserved early growth response family transcription factor, egr-5, that is essential for epidermal differentiation. Disruption of epidermal integrity by egr-5 RNAi triggers a global stress response that induces the proliferation of neoblasts and the concomitant expansion of not only epidermal, but also multiple progenitor cell populations. Our results further establish the planarian epidermis as a novel paradigm to uncover the molecular mechanisms regulating ASC specification in vivo. 
    

    
  ","Tu KC, Cheng LC, T K Vu H, Lange JJ, McKinney SA,A, Seidel CW, Sánchez Alvarado A, ",eLife,http://www.ncbi.nlm.nih.gov/pubmed/26457503,Egr-5 Is a Post-Mitotic Regulator of Planarian Epidermal Differentiation,2015,Sánchez Alvarado A,Tu KC,Sánchez,McKinney SA,9,Microscopy
76,40,"
    

    
      Cystic kidney diseases (CKDs) affect millions of people worldwide. The defining pathological features are fluid-filled cysts developing from nephric tubules due to defective flow sensing, cell proliferation and differentiation. The underlying molecular mechanisms, however, remain poorly understood, and the derived excretory systems of established invertebrate models (Caenorhabditis elegans and Drosophila melanogaster) are unsuitable to model CKDs. Systematic structure/function comparisons revealed that the combination of ultrafiltration and flow-associated filtrate modification that is central to CKD etiology is remarkably conserved between the planarian excretory system and the vertebrate nephron. Consistently, both RNA-mediated genetic interference (RNAi) of planarian orthologues of human CKD genes and inhibition of tubule flow led to tubular cystogenesis that share many features with vertebrate CKDs, suggesting deep mechanistic conservation. Our results demonstrate a common evolutionary origin of animal excretory systems and establish planarians as a novel and experimentally accessible invertebrate model for the study of human kidney pathologies. 
    

    
  ","Thi-Kim Vu H, Rink JC, McKinney SA,A, McClain M, Lakshmanaperumal N, Alexander R, Sánchez Alvarado A, ",eLife,http://www.ncbi.nlm.nih.gov/pubmed/26057828,Stem Cells and Fluid Flow Drive Cyst Formation in an Invertebrate Excretory Organ,2015,Sánchez Alvarado A,Thi-Kim Vu H,Sánchez,McKinney SA,9,Microscopy
77,117,"
    

    
      Genetic manipulations are a vital instrument for the study of embryonic development where to understand how genes work, it is necessary to provoke a loss or gain of function of a particular gene in a spatial and temporal manner. In the zebrafish embryo, the Hsp70 promoter is the most commonly used tool to induce a transient global gene expression of a desired gene, in a temporal manner. However, Hsp70-driven global gene induction presents caveats when studying gene function in a tissue of interest as gene induction in the whole embryo can lead to cell-autonomous and non-cell-autonomous phenotypes. In the current article, we describe an innovative and cost effective protocol to activate Hsp70-dependent expression in a small subset of cells in the zebrafish embryo, by utilizing a localized infrared (IR) laser. Our IR laser set up can be incorporated to any microscope platform without the requirement for expensive equipment. Furthermore, our protocol allows for controlled localized induction of specific proteins under the control of the hsp70 promoter in small subsets of cells. We use the migrating zebrafish sensory lateral line primordium as a model, because of its relative simplicity and experimental accessibility; however, this technique can be applied to any tissue in the zebrafish embryo.
    

    
  ","Venero Galanternik M, Nikaido M, Yu Z, McKinney SA,A, Piotrowski T, ",Zebrafish,http://www.ncbi.nlm.nih.gov/pubmed/27057799,Localized Gene Induction by Infrared-Mediated Heat Shock,2016,Piotrowski T,Venero Galanternik M,Piotrowski,McKinney SA,9,Microscopy
78,133,"
    

    
      A large population of proliferative stem cells (neoblasts) is required for physiological tissue homeostasis and post-injury regeneration in planarians. Recent studies indicate that survival of a few neoblasts after sublethal irradiation results in the clonal expansion of the surviving stem cells and the eventual restoration of tissue homeostasis and regenerative capacity. However, the precise mechanisms regulating the population dynamics of neoblasts remain largely unknown. Here, we uncovered a central role for epidermal growth factor (EGF) signaling during in vivo neoblast expansion mediated by Smed-egfr-3 (egfr-3) and its putative ligand Smed-neuregulin-7 (nrg-7). Furthermore, the EGF receptor-3 protein localizes asymmetrically on the cytoplasmic membrane of neoblasts, and the ratio of asymmetric to symmetric cell divisions decreases significantly in egfr-3(RNAi) worms. Our results not only provide the first molecular evidence of asymmetric stem cell divisions in planarians, but also demonstrate that EGF signaling likely functions as an essential regulator of neoblast clonal expansion.
    

    
  ","Lei K, Thi-Kim Vu H, Mohan RD, McKinney SA,A, Seidel CW, Alexander R, Gotting K, Workman JL, Sánchez Alvarado A, ",Developmental cell,http://www.ncbi.nlm.nih.gov/pubmed/27523733,Egf Signaling Directs Neoblast Repopulation by Regulating Asymmetric Cell Division in Planarians,2016,Sánchez Alvarado A,Lei K,Sánchez,McKinney SA,9,Microscopy
79,137,"
    

    
      The interrelationship between endogenous microbiota, the immune system, and tissue regeneration is an area of intense research due to its potential therapeutic applications. We investigated this relationship in Schmidtea mediterranea, a model organism capable of regenerating any and all of its adult tissues. Microbiome characterization revealed a high Bacteroidetes to Proteobacteria ratio in healthy animals. Perturbations eliciting an expansion of Proteobacteria coincided with ectopic lesions and tissue degeneration. The culture of these bacteria yielded a strain of Pseudomonas capable of inducing progressive tissue degeneration. RNAi screening uncovered a TAK1 innate immune signaling module underlying compromised tissue homeostasis and regeneration during infection. TAK1/MKK/p38 signaling mediated opposing regulation of apoptosis during infection versus normal tissue regeneration. Given the complex role of inflammation in either hindering or supporting reparative wound healing and regeneration, this invertebrate model provides a basis for dissecting the duality of evolutionarily conserved inflammatory signaling in complex, multi-organ adult tissue regeneration.
    

    
  ","Arnold CP, Merryman MS, Harris-Arnold A, McKinney SA,A, Seidel CW, Loethen S, Proctor KN, Guo L, Sánchez Alvarado A, ",eLife,http://www.ncbi.nlm.nih.gov/pubmed/27441386,Pathogenic Shifts in Endogenous Microbiota Impede Tissue Regeneration via Distinct Activation of TAK1/MKK/p38,2016,Sánchez Alvarado A,Arnold CP,Sánchez,McKinney SA,9,Microscopy
80,228,"
    

    
      Throughout animals, embryonic cells must ultimately organize into polarized epithelial layers that provide the structural basis for gastrulation or subsequent developmental events [1]. Precisely how this primary epithelium maintains continuous integrity during rapid and repeated cell divisions has never been directly addressed, particularly in cases where early cleavages are driven in synchrony. Representing the early-branching non-bilaterian phylum Cnidaria, embryos of the sea anemone Nematostella vectensis undergo rapid synchronous cell divisions and ultimately give rise to a diploblastic epithelial body plan after gastrulation [2, 3]. Here, using live imaging of apical polarity proteins in Nematostella embryos, we demonstrate that cell polarity is established by the four-cell stage and then reiteratively lost during subsequent mitoses, correlating with transient adhesion disengagement and dramatic deformations of embryonic morphology. Intriguingly, the re-establishment of polarity and adhesion during each interphase is associated with a process of whole-embryo compaction analogous to that observed in mammals [4-7]. Because similar protein dynamics are observed in dividing epithelial cells in Drosophila melanogaster, we propose that cell-cycle-coupled oscillations in apical polarity may be conserved throughout Metazoa.
    

    
  ","Ragkousi K, Marr K, McKinney SA,, Ellington L, Gibson MC, ",Current biology : CB,https://www.ncbi.nlm.nih.gov/pubmed/28457868,Cell-Cycle-Coupled Oscillations in Apical Polarity and Intercellular Contact Maintain Order in Embryonic Epithelia,2017,Gibson MC,Ragkousi K,Gibson,McKinney SA,9,Microscopy
81,280,"
    

    
      Antimicrobial peptides act as a host defense mechanism and regulate the commensal microbiome. To obtain a comprehensive view of genes contributing to long-term memory we performed mRNA sequencing from single Drosophila heads following behavioral training that produces long-lasting memory. Surprisingly, we found that Diptericin B, an immune peptide with antimicrobial activity, is upregulated following behavioral training. Deletion and knock down experiments revealed that Diptericin B and another immune peptide, Gram-Negative Bacteria Binding Protein like 3, regulate long-term but not short-term memory or instinctive behavior in Drosophila. Interestingly, removal of DptB in the head fat body and GNBP-like3 in neurons results in memory deficit. That putative antimicrobial peptides influence memory provides an example of how some immune peptides may have been repurposed to influence the function of nervous system.
    

    
  ","Barajas-Azpeleta R, Wu J, Gill J, Welte R, Seidel CW, McKinney SA,, Dissel S, Si K, ",PLoS genetics,https://www.ncbi.nlm.nih.gov/pubmed/30312294,Antimicrobial Peptides Modulate Long-Term Memory,2018,Si K,Barajas-Azpeleta R,Si,McKinney SA,9,Microscopy
82,307,"
    

    
      Proliferating cells known as neoblasts include pluripotent stem cells (PSCs) that sustain tissue homeostasis and regeneration of lost body parts in planarians. However, the lack of markers to prospectively identify and isolate these adult PSCs has significantly hampered their characterization. We used single-cell RNA sequencing (scRNA-seq) and single-cell transplantation to address this long-standing issue. Large-scale scRNA-seq of sorted neoblasts unveiled a novel subtype of neoblast (Nb2) characterized by high levels of PIWI-1 mRNA and protein and marked by a conserved cell-surface protein-coding gene, tetraspanin 1 (tspan-1). tspan-1-positive cells survived sub-lethal irradiation, underwent clonal expansion to repopulate whole animals, and when purified with an anti-TSPAN-1 antibody, rescued the viability of lethally irradiated animals after single-cell transplantation. The first prospective isolation of an adult PSC bridges a conceptual dichotomy between functionally and molecularly defined neoblasts, shedding light on mechanisms governing in vivo pluripotency and a source of regeneration in animals. VIDEO ABSTRACT.
    

    
  ","Zeng A, Li H, Guo L, Gao X, McKinney SA,, Wang Y, Yu Z, Park J, Semerad C, Ross E, Cheng LC, Davies E, Lei K, Wang W, Perera AG, Hall K, Peak A, Box AC, Sánchez Alvarado A, ",Cell,https://www.ncbi.nlm.nih.gov/pubmed/29906446,Prospectively Isolated Tetraspanin + Neoblasts Are Adult Pluripotent Stem Cells Underlying Planaria Regeneration,2018,Sánchez Alvarado A,Zeng A,Sánchez,McKinney SA,9,Microscopy
83,323,"
","Guo L, Accorsi A, He S, Guerrero-Hernández C, Sivagnanam S, McKinney SA,, Gibson M, Sánchez Alvarado A, ",BMC biology,https://www.ncbi.nlm.nih.gov/pubmed/29482548,An Adaptable Chromosome Preparation Methodology for Use in Invertebrate Research Organisms,2018,Sánchez Alvarado A,Guo L,Sánchez,McKinney SA,9,Microscopy
84,409,"
    

    
      Proper orientation of the mitotic spindle is essential for cell fate determination, tissue morphogenesis, and homeostasis. During epithelial proliferation, planar spindle alignment ensures the maintenance of polarized tissue architecture, and aberrant spindle orientation can disrupt epithelial integrity. Nevertheless, in vivo mechanisms that restrict the mitotic spindle to the plane of the epithelium remain poorly understood. Here we show that the junction-localized tumor suppressors Scribbled (Scrib) and Discs large (Dlg) control planar spindle orientation via Mud and 14-3-3 proteins in the ","Nakajima YI, Lee ZT, McKinney SA,A, Swanson SK, Florens L, Gibson MC, ",The Journal of cell biology,https://www.ncbi.nlm.nih.gov/pubmed/31088859,Junctional Tumor Suppressors Interact With 14-3-3 Proteins to Control Planar Spindle Alignment,2019,Gibson MC,Nakajima YI,Gibson,McKinney SA,9,Microscopy
85,417,"
    

    
      Bipolar spindle formation in yeast requires insertion of centrosomes (known as spindle pole bodies [SPBs]) into fenestrated regions of the nuclear envelope (NE). Using structured illumination microscopy and bimolecular fluorescence complementation, we map protein distribution at SPB fenestrae and interrogate protein-protein interactions with high spatial resolution. We find that the Sad1-UNC-84 (SUN) protein Mps3 forms a ring-like structure around the SPB, similar to toroids seen for components of the SPB insertion network (SPIN). Mps3 and the SPIN component Mps2 (a Klarsicht-ANC-1-Syne-1 domain [KASH]-like protein) form a novel noncanonical linker of nucleoskeleton and cytoskeleton (LINC) complex that is connected in both luminal and extraluminal domains at the site of SPB insertion. The LINC complex also controls the distribution of a soluble SPIN component Bbp1. Taken together, our work shows that Mps3 is a fifth SPIN component and suggests both direct and indirect roles for the LINC complex in NE remodeling.
    

    
  ","Chen J, Gardner JM, Yu Z, Smith SE, McKinney SA,, Slaughter BD, Unruh JR, Jaspersen SL, ",The Journal of cell biology,https://www.ncbi.nlm.nih.gov/pubmed/30862629,Yeast Centrosome Components Form a Noncanonical LINC Complex at the Nuclear Envelope Insertion Site,2019,Jaspersen SL,Chen J,Jaspersen,McKinney SA,9,Microscopy
86,436,"
    

    
      A mechanistic understanding of evolutionary developmental biology requires the development of novel techniques for the manipulation of gene function in phylogenetically diverse organismal systems. Recently, gene-specific knockdown by microinjection of short hairpin RNA (shRNA) was applied in the sea anemone Nematostella vectensis, demonstrating that the shRNA approach can be used for efficient and robust sequence-specific knockdown of a gene of interest. However, the time- and labor-intensive process of microinjection limits access to this technique and its application in large scale experiments. To address this issue, here we present an electroporation protocol for shRNA delivery into Nematostella eggs. This method leverages the speed and simplicity of electroporation, enabling users to manipulate gene expression in hundreds of eggs or embryos within minutes. We provide a detailed description of the experimental procedure, including reagents, electroporation conditions, preparation of Nematostella eggs, and follow-up care of experimental animals. Finally, we demonstrate the knockdown of several endogenous and exogenous genes with known phenotypes and discuss the potential applications of this method.
    

    
  ","Karabulut A, He S, Chen CY, McKinney SA,A, Gibson MC, ",Developmental biology,https://www.ncbi.nlm.nih.gov/pubmed/30641041,"Electroporation of Short Hairpin RNAs for Rapid and Efficient Gene Knockdown in the Starlet Sea Anemone, Nematostella Vectensis",2019,Gibson MC,Karabulut A,Gibson,McKinney SA,9,Microscopy
87,503,"
    

    
      Planarian neoblasts are pluripotent, adult somatic stem cells and lineage-primed progenitors that are required for the production and maintenance of all differentiated cell types, including the germline. Neoblasts, originally defined as undifferentiated cells residing in the adult parenchyma, are frequently compared to embryonic stem cells yet their developmental origin remains obscure. We investigated the provenance of neoblasts during ","Davies EL, Lei K, Seidel CW, Kroesen AE, McKinney SA,A, Guo L, Robb SM, Ross EJ, Gotting K, Alvarado AS, ",eLife,https://www.ncbi.nlm.nih.gov/pubmed/28072387,Embryonic Origin of Adult Stem Cells Required for Tissue Homeostasis and Regeneration,2017,Sánchez Alvarado A,Davies EL,Sánchez,McKinney SA,9,Microscopy
88,9,"
    

    
      Memories are thought to be formed in response to transient experiences, in part through changes in local protein synthesis at synapses. In Drosophila, the amyloidogenic (prion-like) state of the RNA binding protein Orb2 has been implicated in long-term memory, but how conformational conversion of Orb2 promotes memory formation is unclear. Combining in vitro and in vivo studies, we find that the monomeric form of Orb2 represses translation and removes mRNA poly(A) tails, while the oligomeric form enhances translation and elongates the poly(A) tails and imparts its translational state to the monomer. The CG13928 protein, which binds only to monomeric Orb2, promotes deadenylation, whereas the putative poly(A) binding protein CG4612 promotes oligomeric Orb2-dependent translation. Our data support a model in which monomeric Orb2 keeps target mRNA in a translationally dormant state and experience-dependent conversion to the amyloidogenic state activates translation, resulting in persistent alteration of synaptic activity and stabilization of memory.
    

    
  ","Khan MR, Li L, Pérez-Sánchez C, Saraf A, Florens L, Slaughter BD, Unruh JR, Si K, ",Cell,http://www.ncbi.nlm.nih.gov/pubmed/26638074,Amyloidogenic Oligomerization Transforms Drosophila Orb2 From a Translation Repressor to an Activator,2015,Si K,Khan MR,Si,Saraf A,22,Proteomics
89,111,"
    

    
      Mediator plays an integral role in activation of RNA polymerase II (Pol II) transcription. A key step in activation is binding of Mediator to Pol II to form the Mediator-Pol II holoenzyme. Here, we exploit a combination of biochemistry and macromolecular EM to investigate holoenzyme assembly. We identify a subset of human Mediator head module subunits that bind Pol II independent of other subunits and thus probably contribute to a major Pol II binding site. In addition, we show that binding of human Mediator to Pol II depends on the integrity of a conserved ""hinge"" in the middle module MED21-MED7 heterodimer. Point mutations in the hinge region leave core Mediator intact but lead to increased disorder of the middle module and markedly reduced affinity for Pol II. These findings highlight the importance of Mediator conformation for holoenzyme assembly.
    

    
  ","Sato S, Tomomori-Sato C, Tsai KL, Yu X, Sardiu M, Saraf A, Washburn MP, Florens L, Asturias FJ, Conaway RC, Conaway JW, ",The Journal of biological chemistry,https://www.ncbi.nlm.nih.gov/pubmed/27821593,Role for the MED21-MED7 Hinge in Assembly of the Mediator-RNA Polymerase II Holoenzyme,2016,Conaway JW,Sato S,Conaway,Saraf A,22,Proteomics
90,147,"
    

    
      KAT6 histone acetyltransferases (HATs) are highly conserved in eukaryotes and are involved in cell cycle regulation. However, information regarding their roles in regulating cell cycle progression is limited. Here, we report the identification of subunits of the Drosophila Enok complex and demonstrate that all subunits are important for its HAT activity. We further report a novel interaction between the Enok complex and the Elg1 proliferating cell nuclear antigen (PCNA)-unloader complex. Depletion of Enok in S2 cells resulted in a G1/S cell cycle block, and this block can be partially relieved by depleting Elg1. Furthermore, depletion of Enok reduced the chromatin-bound levels of PCNA in both S2 cells and early embryos, suggesting that the Enok complex may interact with the Elg1 complex and down-regulate its PCNA-unloading function to promote the G1/S transition. Supporting this hypothesis, depletion of Enok also partially rescued the endoreplication defects in Elg1-depleted nurse cells. Taken together, our study provides novel insights into the roles of KAT6 HATs in cell cycle regulation through modulating PCNA levels on chromatin.
    

    
  ","Huang F, Saraf A, Florens L, Kusch T, Swanson SK, Szerszen LT, Li G, Dutta A, Washburn MP, Abmayr SM, Workman JL, ",Genes & development,http://www.ncbi.nlm.nih.gov/pubmed/27198229,The Enok Acetyltransferase Complex Interacts With Elg1 and Negatively Regulates PCNA Unloading to Promote the G1/S Transition,2016,Workman JL,Huang F,Workman,Saraf A,22,Proteomics
91,370,"
    

    
      The tumor-suppressing function of SMAD4 is frequently subverted during mammary tumorigenesis, leading to cancer growth, invasion, and metastasis. A long-standing concept is that SMAD4 is not regulated by phosphorylation but ubiquitination. Our search for signaling pathways regulated by breast tumor kinase (BRK), a nonreceptor protein tyrosine kinase that is up-regulated in ~80% of invasive ductal breast tumors, led us to find that BRK competitively binds and phosphorylates SMAD4 and regulates transforming growth factor-β/SMAD4 signaling pathway. A constitutively active BRK (BRK-Y447F) phosphorylates SMAD4, resulting in its recognition by the ubiquitin-proteasome system, which accelerates SMAD4 degradation. Activated BRK-mediated degradation of SMAD4 is associated with the repression of tumor suppressor gene ","Miah S, Banks CAS, Ogunbolude Y, Bagu ET, Berg JM, Saraf A, Tettey TT, Hattem G, Dayebgadoh G, Kempf CG, Sardiu M, Napper S, Florens L, Lukong KE, Washburn MP, ",Science advances,https://www.ncbi.nlm.nih.gov/pubmed/31681835,"BRK Phosphorylates SMAD4 for Proteasomal Degradation and Inhibits Tumor Suppressor FRK to Control SNAIL, SLUG, and Metastatic Potential",2019,Washburn MP,Miah S,Washburn,Saraf A,22,Proteomics
92,402,"
    

    
      Prion-like proteins can assume distinct conformational and physical states in the same cell. Sequence analysis suggests that prion-like proteins are prevalent in various species; however, it remains unclear what functional space they occupy in multicellular organisms. Here, we report the identification of a prion-like protein, Herzog (CG5830), through a multimodal screen in Drosophila melanogaster. Herzog functions as a membrane-associated phosphatase and controls embryonic patterning, likely being involved in TGF-β/BMP and FGF/EGF signaling pathways. Remarkably, monomeric Herzog is enzymatically inactive and becomes active upon amyloid-like assembly. The prion-like domain of Herzog is necessary for both its assembly and membrane targeting. Removal of the prion-like domain impairs activity, while restoring assembly on the membrane using a heterologous prion-like domain and membrane-targeting motif can restore phosphatase activity. This study provides an example of a prion-like domain that allows an enzyme to gain essential functionality via amyloid-like assembly to control animal development.
    

    
  ","Nil Z, Hervás R, Gerbich T, Leal P, Yu Z, Saraf A, Sardiu M, Lange JJ, Yi K, Unruh JR, Slaughter B, Si K, ",Cell,https://www.ncbi.nlm.nih.gov/pubmed/31491385,Amyloid-like Assembly Activates a Phosphatase in the Developing Drosophila Embryo,2019,Si K,Nil Z,Si,Saraf A,22,Proteomics
